{"schema":"collaboration-worker-outcome/v2","collaboration_worker_outcome_id":"collaboration-outcome-fixture-v2-B","ticket":{"collaboration_ticket_id":"collaboration-ticket-fixture-B","sha256":"1111111111111111111111111111111111111111111111111111111111111111"},"route_id":"b","role":"explorer_b","status":"failed","candidate_artifacts":[],"verified_partial_artifacts":[],"substantive_method_changes":[],"opportunity_chain":[],"cannot_imply":[],"reopen_conditions":[],"resource_usage":{"runtime_seconds":1,"tool_calls":0,"output_bytes":0,"extra_budget_extensions":0},"scope_compliance":{"target_unchanged":true,"claim_scope_unchanged":true,"evidence_standard_preserved":true,"permissions_respected":true},"failure":{"stage":"usage_validation","code":"usage_incomplete_or_inconsistent"},"adapter":{"tool":"codex-cli-collaboration-adapter","version":"0.1.0","evidence_class":"real_codex_cli","cli_version":"codex-cli-fixture","model":"fixture-model","reasoning_effort":"xhigh","launcher_sha256":"2222222222222222222222222222222222222222222222222222222222222222"},"execution":{"launcher_process_started":true,"agent_session_started":true,"agent_turn_completed":true,"session_sha256":"3333333333333333333333333333333333333333333333333333333333333333","trace_sha256":"4444444444444444444444444444444444444444444444444444444444444444","stderr_sha256":"5555555555555555555555555555555555555555555555555555555555555555","execution_status":"completed","process_cleanup_status":"not_required","process_tree_cleanup_verified":true,"workspace_cleanup_verified":true,"usage":{"input_tokens":0,"cached_input_tokens":0,"output_tokens":0,"total_tokens":0,"usage_closed":false}},"claims":{"synthetic_collaboration_contract_exercised":false,"real_multi_agent_execution_observed":false,"real_agent_identity_verified":false,"collaboration_seam_stable":false,"independent_verification_completed":false,"publication_authorized":false,"installation_authorized":false,"activation_authorized":false,"promotion_authorized":false},"generated_at":"2026-09-05T00:00:00Z","limitations":["Bounded process only","No identity claim","No independent review","No lifecycle authority"]}
